{
  "version": 1,
  "description": "Every path an install target plans, with the tool surface it serves and the source that says the tool reads it. tests/ci/tool-paths-contract.test.js plans every adapter in every variant and fails when a planned path is outside this table or a row matches nothing; docs/spec/tool-paths.md is generated from it.",
  "checkedOn": "2026-10-10",
  "variants": [
    {
      "id": "default",
      "description": "Linux or macOS, no override variable set",
      "platform": "linux",
      "env": {}
    },
    {
      "id": "win32",
      "description": "Windows, where Devin and Zed keep their user config under %APPDATA%",
      "platform": "win32",
      "env": {},
      "adapters": [
        "windsurf-home",
        "zed-home"
      ]
    },
    {
      "id": "XDG_CONFIG_HOME",
      "description": "XDG_CONFIG_HOME set to an absolute directory, which moves the Crush config directory (a relative value is ignored and Crush stays in ~/.config/crush)",
      "platform": "linux",
      "env": {
        "XDG_CONFIG_HOME": "$XDG_CONFIG_HOME"
      },
      "adapters": [
        "crush-home"
      ]
    },
    {
      "id": "CRUSH_GLOBAL_CONFIG",
      "description": "CRUSH_GLOBAL_CONFIG set, which names the Crush config directory directly (resolved to an absolute path)",
      "platform": "linux",
      "env": {
        "CRUSH_GLOBAL_CONFIG": "$CRUSH_GLOBAL_CONFIG"
      },
      "adapters": [
        "crush-home"
      ]
    },
    {
      "id": "KIMI_CODE_HOME",
      "description": "KIMI_CODE_HOME set, which moves the Kimi Code data root",
      "platform": "linux",
      "env": {
        "KIMI_CODE_HOME": "$KIMI_CODE_HOME"
      },
      "adapters": [
        "kimi-home"
      ]
    },
    {
      "id": "TRAE_ENV=cn",
      "description": "TRAE_ENV=cn, the Chinese edition of Trae",
      "platform": "linux",
      "env": {
        "TRAE_ENV": "cn"
      },
      "adapters": [
        "trae-project"
      ]
    },
    {
      "id": "VIBE_HOME",
      "description": "VIBE_HOME set, which moves the Mistral Vibe data root",
      "platform": "linux",
      "env": {
        "VIBE_HOME": "$VIBE_HOME"
      },
      "adapters": [
        "vibe-home"
      ]
    }
  ],
  "rows": [
    {
      "adapter": "egc-home",
      "surface": "context",
      "path": "~/.gemini/AGENTS.md",
      "status": "documented",
      "source": "https://antigravity.google/docs/rules"
    },
    {
      "adapter": "egc-home",
      "surface": "agents",
      "path": "~/.gemini/config/agents/",
      "status": "documented",
      "source": "https://antigravity.google/docs/subagents"
    },
    {
      "adapter": "egc-home",
      "surface": "hooks",
      "path": "~/.gemini/config/hooks.json",
      "status": "documented",
      "source": "https://antigravity.google/docs/hooks"
    },
    {
      "adapter": "egc-home",
      "surface": "rules",
      "path": "~/.gemini/config/rules/",
      "status": "documented",
      "source": "https://antigravity.google/docs/rules"
    },
    {
      "adapter": "egc-home",
      "surface": "skills",
      "path": "~/.gemini/config/skills/",
      "status": "documented",
      "source": "https://antigravity.google/docs/skills"
    },
    {
      "adapter": "egc-home",
      "surface": "runtime",
      "path": "~/.gemini/scripts/",
      "status": "egc",
      "note": "EGC runtime: the scripts the tool's hook or plugin entries run."
    },
    {
      "adapter": "egc-home",
      "surface": "state",
      "path": "~/.gemini/egc/install-state.json",
      "status": "egc",
      "note": "EGC runtime: the install state EGC writes to track the files it manages."
    },
    {
      "adapter": "claude-home",
      "surface": "agents",
      "path": "~/.claude/agents/",
      "status": "documented",
      "source": "https://docs.anthropic.com/en/docs/claude-code/sub-agents"
    },
    {
      "adapter": "claude-home",
      "surface": "commands",
      "path": "~/.claude/commands/",
      "status": "documented",
      "source": "https://docs.anthropic.com/en/docs/claude-code/slash-commands"
    },
    {
      "adapter": "claude-home",
      "surface": "runtime",
      "path": "~/.claude/egc/",
      "status": "egc",
      "note": "EGC runtime: install state and support files EGC reads."
    },
    {
      "adapter": "claude-home",
      "surface": "runtime",
      "path": "~/.claude/hooks/",
      "status": "egc",
      "note": "EGC runtime: hook scripts the hook configuration of the tool points at."
    },
    {
      "adapter": "claude-home",
      "surface": "rules",
      "path": "~/.claude/rules/",
      "status": "documented",
      "source": "https://docs.anthropic.com/en/docs/claude-code/memory"
    },
    {
      "adapter": "claude-home",
      "surface": "runtime",
      "path": "~/.claude/scripts/",
      "status": "egc",
      "note": "EGC runtime: the scripts the tool's hook or plugin entries run."
    },
    {
      "adapter": "claude-home",
      "surface": "settings",
      "path": "~/.claude/settings.json",
      "status": "documented",
      "source": "https://docs.anthropic.com/en/docs/claude-code/settings"
    },
    {
      "adapter": "claude-home",
      "surface": "skills",
      "path": "~/.claude/skills/",
      "status": "documented",
      "source": "https://docs.anthropic.com/en/docs/claude-code/skills"
    },
    {
      "adapter": "cursor-project",
      "surface": "library",
      "path": "<project>/.cursor/.agents/",
      "status": "egc",
      "note": "EGC library folder: a reference copy of the prompt library that the tool does not load on its own."
    },
    {
      "adapter": "cursor-project",
      "surface": "agents",
      "path": "<project>/.cursor/agents/",
      "status": "documented",
      "source": "https://cursor.com/docs/context/subagents"
    },
    {
      "adapter": "cursor-project",
      "surface": "runtime",
      "path": "<project>/.cursor/hooks/",
      "status": "egc",
      "note": "EGC runtime: hook scripts the hook configuration of the tool points at."
    },
    {
      "adapter": "cursor-project",
      "surface": "hooks",
      "path": "<project>/.cursor/hooks.json",
      "status": "documented",
      "source": "https://cursor.com/docs/agent/hooks",
      "note": "Seeded from the repository's .cursor/hooks.json with documented events only (read on 2026-10-10): sessionStart, sessionEnd, preToolUse, beforeShellExecution, afterShellExecution, afterFileEdit, beforeMCPExecution, afterMCPExecution, beforeReadFile, beforeSubmitPrompt, subagentStart, subagentStop, beforeTabFileRead, afterTabFileEdit, preCompact, stop. beforeFileEdit is not documented: on upgrade only the entry EGC wrote under it is removed, and entries of the person's own stay."
    },
    {
      "adapter": "cursor-project",
      "surface": "library",
      "path": "<project>/.cursor/mcp-configs/",
      "status": "egc",
      "note": "EGC library: platform configuration sources copied for reference; the tool does not load this path."
    },
    {
      "adapter": "cursor-project",
      "surface": "mcp",
      "path": "<project>/.cursor/mcp.json",
      "status": "documented",
      "source": "https://cursor.com/docs/context/mcp"
    },
    {
      "adapter": "cursor-project",
      "surface": "rules",
      "path": "<project>/.cursor/rules/",
      "status": "documented",
      "source": "https://cursor.com/docs/context/rules"
    },
    {
      "adapter": "cursor-project",
      "surface": "runtime",
      "path": "<project>/.cursor/scripts/",
      "status": "egc",
      "note": "EGC runtime: the scripts the tool's hook or plugin entries run."
    },
    {
      "adapter": "cursor-project",
      "surface": "skills",
      "path": "<project>/.cursor/skills/",
      "status": "documented",
      "source": "https://cursor.com/docs/context/skills",
      "note": "Cursor documents custom commands only as skills invoked by /<name> and finds them in nested folders (read on 2026-10-11), so each EGC command is a skill at .cursor/skills/<name>/SKILL.md with disable-model-invocation: true, and a bundled skill of the same name wins. The old .cursor/commands copies are retired only while they hold EGC's bytes."
    },
    {
      "adapter": "cursor-project",
      "surface": "state",
      "path": "<project>/.cursor/egc-install-state.json",
      "status": "egc",
      "note": "EGC runtime: the install state EGC writes to track the files it manages."
    },
    {
      "adapter": "antigravity-project",
      "surface": "library",
      "path": "<project>/.agents/.agents/",
      "status": "egc",
      "note": "EGC library folder: a reference copy of the prompt library that the tool does not load on its own."
    },
    {
      "adapter": "antigravity-project",
      "surface": "context",
      "path": "<project>/.agents/AGENTS.md",
      "status": "documented",
      "source": "https://antigravity.google/docs/rules"
    },
    {
      "adapter": "antigravity-project",
      "surface": "agents",
      "path": "<project>/.agents/agents/",
      "status": "documented",
      "source": "https://antigravity.google/docs/subagents"
    },
    {
      "adapter": "antigravity-project",
      "surface": "hooks",
      "path": "<project>/.agents/hooks.json",
      "status": "documented",
      "source": "https://antigravity.google/docs/hooks"
    },
    {
      "adapter": "antigravity-project",
      "surface": "rules",
      "path": "<project>/.agents/rules/",
      "status": "documented",
      "source": "https://antigravity.google/docs/rules"
    },
    {
      "adapter": "antigravity-project",
      "surface": "runtime",
      "path": "<project>/.agents/scripts/",
      "status": "egc",
      "note": "EGC runtime: the scripts the tool's hook or plugin entries run."
    },
    {
      "adapter": "antigravity-project",
      "surface": "skills",
      "path": "<project>/.agents/skills/",
      "status": "documented",
      "source": "https://antigravity.google/docs/skills"